{
	"$schema": "https://json-schema.org/draft/2020-12/schema",
	"$id": "https://schema.kalkulacka.one/organization.schema.json",
	"title": "Organization",
	"description": "Organization is a group of people, for example a political party, a movement, etc.",
	"type": "object",
	"$defs": {
		"person": {
			"title": "Person",
			"description": "Reference to a person",
			"type": "object",
			"properties": {
				"id": {
					"$ref": "./person.schema.json#/properties/id"
				},
				"type": {
					"type": "string",
					"const": "person"
				}
			},
			"unevaluatedProperties": false,
			"required": ["id", "type"]
		},
		"organization": {
			"title": "Organization",
			"description": "Reference to an organization",
			"type": "object",
			"properties": {
				"id": {
					"$ref": "./organization.schema.json#/properties/id"
				},
				"type": {
					"type": "string",
					"const": "organization"
				}
			},
			"unevaluatedProperties": false,
			"required": ["id", "type"]
		}
	},
	"properties": {
		"id": {
			"title": "ID",
			"description": "Unique identifier of an organization in the format of UUID",
			"type": "string",
			"format": "uuid",
			"examples": ["5fb7d561-6e93-45c2-9c75-6a1f2b11deb4"]
		},
		"name": {
			"title": "Name",
			"description": "Organization's preferred full name",
			"type": "string"
		},
		"officialName": {
			"title": "Short name",
			"description": "Organization's official name with an unlimited length",
			"type": "string"
		},
		"shortName": {
			"title": "Short name",
			"description": "Organization's short name with max. 25 characters",
			"maxLength": 25,
			"type": "string"
		},
		"abbreviation": {
			"title": "Abbreviation",
			"description": "Organization's abbreviation with max. 15 characters",
			"maxLength": 15,
			"type": "string"
		},
		"sortName": {
			"description": "A name to use in a lexicographically ordered list",
			"type": "string"
		},
		"alternateNames": {
			"description": "Alternate names to use for example in search",
			"type": "array",
			"items": {
				"type": "string"
			}
		},
		"images": {
			"$ref": "./images.schema.json"
		},
		"type": {
			"title": "Organization type",
			"description": "Whether the organization is a political party/movement, coalition or a candidate list",
			"type": "string",
			"enum": ["party", "coalition", "candidate-list"]
		},
		"members": {
			"title": "Members",
			"description": "List of members of an organization",
			"type": "array",
			"minItems": 1,
			"items": {
				"oneOf": [
					{
						"$ref": "#/$defs/person"
					},
					{
						"$ref": "#/$defs/organization"
					}
				]
			}
		}
	},
	"unevaluatedProperties": false,
	"required": ["id", "name"],
	"anyOf": [
		{
			"required": ["shortName"]
		},
		{
			"required": ["abbreviation"]
		}
	]
}
