[
  {
    "id": "e8833483-680f-435a-af44-b759327578c8",
    "name": "ANO",
    "sortName": "ANO",
    "shortName": "ANO",
    "type": "candidate-list"
  },
  {
    "id": "bc382abd-a642-43b9-b64e-0ca563ac4ca3",
    "name": "ČSNS+KSČM+SD-SN",
    "sortName": "ČSNS+KSČM+SD-SN",
    "shortName": "ČSNS+KSČM+SD-SN",
    "type": "candidate-list"
  },
  {
    "id": "20a54dd5-96f0-4740-b7e2-67f621d32715",
    "name": "Ostravak",
    "sortName": "Ostravak",
    "shortName": "Ostravak",
    "type": "candidate-list"
  },
  {
    "id": "e2e60e7a-5165-40e8-a233-068db4e79888",
    "name": "ReMeK",
    "sortName": "ReMeK",
    "shortName": "ReMeK",
    "type": "candidate-list"
  },
  {
    "id": "5cb5d56c-688e-4b55-a801-8a803d939aab",
    "name": "SPD+Trikolora",
    "sortName": "SPD+Trikolora",
    "shortName": "SPD+Trikolora",
    "type": "candidate-list"
  },
  {
    "id": "6797d805-5e00-4f26-acb5-a61f8b4895ba",
    "name": "Svobodní",
    "sortName": "Svobodní",
    "shortName": "Svobodní",
    "type": "candidate-list"
  },
  {
    "id": "7dfbba65-9e0f-4654-bf9b-81eca8783f8f",
    "name": "Švýcar. demokr.",
    "sortName": "Švýcar. demokr.",
    "shortName": "Švýcar. demokr.",
    "type": "candidate-list"
  }
]